{
  "artist_meaning_id": "meaning_door_left_lit",
  "source_id": "src_door_left_lit",
  "version": 1,
  "supersedes_artist_meaning_id": null,
  "why_it_matters": "The piece is about returning to a place that is no longer emotionally safe, while still feeling tenderness for it.",
  "must_preserve": [
    "the threshold between returning and leaving",
    "the key as fragile agency",
    "absence as an active presence"
  ],
  "may_transform": [
    "the exact room can become another threshold setting",
    "the key can become an equivalent object of choice"
  ],
  "avoid": [
    "resolving whether the speaker enters",
    "showing the absent person",
    "turning the grief into explicit horror"
  ],
  "target_media_type": "image",
  "artist_emotional_language": [
    "tender and dangerous",
    "almost home",
    "holding still because choosing would break something"
  ],
  "success_criteria": [
    "the output keeps the threshold unresolved",
    "the image feels specific rather than generically sad",
    "the agency remains small and fragile"
  ],
  "decision_interview": [
    {
      "decision_area": "meaning",
      "question": "What does this Reference mean to you, and what must survive when it changes form?",
      "recommended_answer": "It seems to be about returning to a place that still calls to you but no longer feels safe; the unresolved threshold must survive.",
      "artist_response": "Yes, it is about returning to a place that is no longer emotionally safe while still feeling tenderness for it.",
      "status": "revised"
    },
    {
      "decision_area": "intended_feeling",
      "question": "What should the audience feel first?",
      "recommended_answer": "Tender danger: almost home, but choosing would break something.",
      "artist_response": "Tender and dangerous, almost home, holding still because choosing would break something.",
      "status": "accepted"
    },
    {
      "decision_area": "avoid",
      "question": "What would betray the piece?",
      "recommended_answer": "Resolving whether she enters, showing the absent person, or turning the grief into explicit horror.",
      "artist_response": "Do not resolve whether the speaker enters, do not show the absent person, and do not make it horror.",
      "status": "accepted"
    },
    {
      "decision_area": "story_shape",
      "question": "Should this be one compressed image or a series?",
      "recommended_answer": "Start as one image, but keep the triptych option open if the threshold needs a before/threshold/residue arc.",
      "artist_response": "Start with image; a triptych could be useful if the beats need room.",
      "status": "accepted"
    },
    {
      "decision_area": "success_criteria",
      "question": "How will we know the first draft worked?",
      "recommended_answer": "It keeps the threshold unresolved, feels specific rather than generically sad, and preserves the key as small fragile agency.",
      "artist_response": "Yes, those are the success criteria.",
      "status": "accepted"
    }
  ],
  "contradictions_or_overrides": [
    {
      "agent_assumption": "The lit doorway might imply welcome or resolution.",
      "artist_override": "The light should feel inviting and unsafe at the same time."
    }
  ],
  "confirmation_status": "confirmed",
  "created_at": "2026-06-04T11:40:00Z"
}
